{
  "schema_name": "DECISION_LEDGER_V1",
  "schema_version": "1.0.0",
  "ledger_id": "LEDGER-0001",
  "canonicalization": "JCS_SHA256_V1",
  "entries": [
    {
      "entry_index": 0,
      "ts": "2026-04-19T17:00:00+00:00",
      "prev_entry_hash": null,
      "decision": {
        "schema_name": "SKILL_PROMOTION_DECISION_V1",
        "schema_version": "1.0.0",
        "decision_id": "debug_2026-04-19_dec_000",
        "skill_id": "skill.debug_2026-04-19.epoch_00",
        "candidate_version": "1.0.0",
        "decision_type": "ADMITTED",
        "reason_code": "OK_ADMITTED",
        "candidate_identity_hash": "sha256:d126a3021411c08d2a7fea97ea087a056db5bf7f16b36d0e98b11e07256043be"
      },
      "entry_hash": "sha256:fc01e4397e4d520d4bfc23382fd52a3cb00549af7328561c0a7b3783d5a964ba"
    },
    {
      "entry_index": 1,
      "ts": "2026-04-19T17:00:00+00:00",
      "prev_entry_hash": "sha256:fc01e4397e4d520d4bfc23382fd52a3cb00549af7328561c0a7b3783d5a964ba",
      "decision": {
        "schema_name": "SKILL_PROMOTION_DECISION_V1",
        "schema_version": "1.0.0",
        "decision_id": "debug_2026-04-19_dec_001",
        "skill_id": "skill.debug_2026-04-19.epoch_01",
        "candidate_version": "1.1.0",
        "decision_type": "ADMITTED",
        "reason_code": "OK_ADMITTED",
        "candidate_identity_hash": "sha256:ecf7baafeaaa993e3ef1ded9eb6fbf65992e77c42200c2893845edb638acdec5"
      },
      "entry_hash": "sha256:1f2385664aa98ca98d32ff910e714a575c52ed8e683ccfbe7bdafa391aafb76e"
    },
    {
      "entry_index": 2,
      "ts": "2026-04-19T17:00:00+00:00",
      "prev_entry_hash": "sha256:1f2385664aa98ca98d32ff910e714a575c52ed8e683ccfbe7bdafa391aafb76e",
      "decision": {
        "schema_name": "SKILL_PROMOTION_DECISION_V1",
        "schema_version": "1.0.0",
        "decision_id": "debug_2026-04-19_dec_002",
        "skill_id": "skill.debug_2026-04-19.epoch_02",
        "candidate_version": "1.2.0",
        "decision_type": "ADMITTED",
        "reason_code": "OK_ADMITTED",
        "candidate_identity_hash": "sha256:7e47d6cf511c5d46df2771a58317d3ce3803418cbf509d55f0b4c0f060e6cc65"
      },
      "entry_hash": "sha256:1cd4b53b0c17fd0c96cb8f6fe4e89e8d52c87073539174910896b432390ee2ac"
    },
    {
      "entry_index": 3,
      "ts": "2026-04-19T17:00:00+00:00",
      "prev_entry_hash": "sha256:1cd4b53b0c17fd0c96cb8f6fe4e89e8d52c87073539174910896b432390ee2ac",
      "decision": {
        "schema_name": "SKILL_PROMOTION_DECISION_V1",
        "schema_version": "1.0.0",
        "decision_id": "debug_2026-04-19_dec_003",
        "skill_id": "skill.debug_2026-04-19.epoch_03",
        "candidate_version": "1.3.0",
        "decision_type": "ADMITTED",
        "reason_code": "OK_ADMITTED",
        "candidate_identity_hash": "sha256:f237b061eece7573c1aceebed1c0b5c76235134643a96c835668176a1d5c8e8a"
      },
      "entry_hash": "sha256:03c3ca785e5700bb5138866e3c39eb14d74e3e24c1ee4ca9482b6e1dc7429aa7"
    },
    {
      "entry_index": 4,
      "ts": "2026-04-19T17:00:00+00:00",
      "prev_entry_hash": "sha256:03c3ca785e5700bb5138866e3c39eb14d74e3e24c1ee4ca9482b6e1dc7429aa7",
      "decision": {
        "schema_name": "SKILL_PROMOTION_DECISION_V1",
        "schema_version": "1.0.0",
        "decision_id": "debug_2026-04-19_dec_004",
        "skill_id": "skill.debug_2026-04-19.epoch_04",
        "candidate_version": "1.4.0",
        "decision_type": "REJECTED",
        "reason_code": "ERR_THRESHOLD_NOT_MET"
      },
      "entry_hash": "sha256:3d3d85299341ba60079614aee734bb10ac688699fb07d97f09744558bd4ed675"
    },
    {
      "entry_index": 5,
      "ts": "2026-04-19T17:00:00+00:00",
      "prev_entry_hash": "sha256:3d3d85299341ba60079614aee734bb10ac688699fb07d97f09744558bd4ed675",
      "decision": {
        "schema_name": "SKILL_PROMOTION_DECISION_V1",
        "schema_version": "1.0.0",
        "decision_id": "debug_2026-04-19_dec_005",
        "skill_id": "skill.debug_2026-04-19.epoch_05",
        "candidate_version": "1.5.0",
        "decision_type": "ADMITTED",
        "reason_code": "OK_ADMITTED",
        "candidate_identity_hash": "sha256:4fcf52462a0745d4c7bb47b4a0e785d342745c7e0d9dc27319cc947b576416de"
      },
      "entry_hash": "sha256:82519866436106fc066b7b7105a1c66a4515de19c25a1b448cf98aac65e92c92"
    },
    {
      "entry_index": 6,
      "ts": "2026-04-19T17:00:00+00:00",
      "prev_entry_hash": "sha256:82519866436106fc066b7b7105a1c66a4515de19c25a1b448cf98aac65e92c92",
      "decision": {
        "schema_name": "SKILL_PROMOTION_DECISION_V1",
        "schema_version": "1.0.0",
        "decision_id": "debug_2026-04-19_dec_006",
        "skill_id": "skill.debug_2026-04-19.epoch_06",
        "candidate_version": "1.6.0",
        "decision_type": "ADMITTED",
        "reason_code": "OK_ADMITTED",
        "candidate_identity_hash": "sha256:c3cd1b64270e35cbb9ac9cea7b0d307913956ec961bc711e872bb99fcf7e23a1"
      },
      "entry_hash": "sha256:5c12a125272ab90379c3af58541f13de5b68d93bc5847dd23f063c156582e0b1"
    },
    {
      "entry_index": 7,
      "ts": "2026-04-19T17:00:00+00:00",
      "prev_entry_hash": "sha256:5c12a125272ab90379c3af58541f13de5b68d93bc5847dd23f063c156582e0b1",
      "decision": {
        "schema_name": "SKILL_PROMOTION_DECISION_V1",
        "schema_version": "1.0.0",
        "decision_id": "debug_2026-04-19_dec_007",
        "skill_id": "skill.debug_2026-04-19.epoch_07",
        "candidate_version": "1.7.0",
        "decision_type": "ADMITTED",
        "reason_code": "OK_ADMITTED",
        "candidate_identity_hash": "sha256:447be7a305e53d666a4f5e77a93c8d3532604cd746c8b552813b5a133394df7e"
      },
      "entry_hash": "sha256:e2413a80d91abc922205079bb5e061c197f132c4f296eb36f8db67a5e5e6fb9b"
    },
    {
      "entry_index": 8,
      "ts": "2026-04-19T17:00:00+00:00",
      "prev_entry_hash": "sha256:e2413a80d91abc922205079bb5e061c197f132c4f296eb36f8db67a5e5e6fb9b",
      "decision": {
        "schema_name": "SKILL_PROMOTION_DECISION_V1",
        "schema_version": "1.0.0",
        "decision_id": "debug_2026-04-19_dec_008",
        "skill_id": "skill.debug_2026-04-19.epoch_08",
        "candidate_version": "1.8.0",
        "decision_type": "ADMITTED",
        "reason_code": "OK_ADMITTED",
        "candidate_identity_hash": "sha256:0e05d3bd1ec6c8dd6cfdd59b1796f4cb8a72b2dbaf6d1b8c025c64654eb0d385"
      },
      "entry_hash": "sha256:a51760cd0463a988da82434c4edc56f9aa3764ce95875cb9af75849840eb3ec9"
    },
    {
      "entry_index": 9,
      "ts": "2026-04-19T17:00:00+00:00",
      "prev_entry_hash": "sha256:a51760cd0463a988da82434c4edc56f9aa3764ce95875cb9af75849840eb3ec9",
      "decision": {
        "schema_name": "SKILL_PROMOTION_DECISION_V1",
        "schema_version": "1.0.0",
        "decision_id": "debug_2026-04-19_dec_009",
        "skill_id": "skill.debug_2026-04-19.epoch_09",
        "candidate_version": "1.9.0",
        "decision_type": "REJECTED",
        "reason_code": "ERR_THRESHOLD_NOT_MET"
      },
      "entry_hash": "sha256:c8cce04d9e310964807acb36f75b7d20e7afc8d817e0ec2b47aea35609bf4453"
    },
    {
      "entry_index": 10,
      "ts": "2026-04-19T17:00:00+00:00",
      "prev_entry_hash": "sha256:c8cce04d9e310964807acb36f75b7d20e7afc8d817e0ec2b47aea35609bf4453",
      "decision": {
        "schema_name": "SKILL_PROMOTION_DECISION_V1",
        "schema_version": "1.0.0",
        "decision_id": "debug_2026-04-19_dec_010",
        "skill_id": "skill.debug_2026-04-19.epoch_10",
        "candidate_version": "1.10.0",
        "decision_type": "ADMITTED",
        "reason_code": "OK_ADMITTED",
        "candidate_identity_hash": "sha256:bcfb55765e1046a3ae382dd927d272f53243dc21220dc09600fd298300103dd2"
      },
      "entry_hash": "sha256:2cbfa0cffeb0d186f2c74fe9a0376cda5d910ff3c9f330fbef92f6a8b26ff307"
    },
    {
      "entry_index": 11,
      "ts": "2026-04-19T17:00:00+00:00",
      "prev_entry_hash": "sha256:2cbfa0cffeb0d186f2c74fe9a0376cda5d910ff3c9f330fbef92f6a8b26ff307",
      "decision": {
        "schema_name": "SKILL_PROMOTION_DECISION_V1",
        "schema_version": "1.0.0",
        "decision_id": "debug_2026-04-19_dec_011",
        "skill_id": "skill.debug_2026-04-19.epoch_11",
        "candidate_version": "1.11.0",
        "decision_type": "ADMITTED",
        "reason_code": "OK_ADMITTED",
        "candidate_identity_hash": "sha256:25a0a111924f01299f1af8c1fb33ef1f516386d1b2f4771e3e32a6385c88eb64"
      },
      "entry_hash": "sha256:ba57b173a33f9b5d0e55cd746a7089b65141b3c750760b6acb5dc0b99d9fbd2f"
    },
    {
      "entry_index": 12,
      "ts": "2026-04-19T17:00:00+00:00",
      "prev_entry_hash": "sha256:ba57b173a33f9b5d0e55cd746a7089b65141b3c750760b6acb5dc0b99d9fbd2f",
      "decision": {
        "schema_name": "SKILL_PROMOTION_DECISION_V1",
        "schema_version": "1.0.0",
        "decision_id": "debug_2026-04-19_dec_012",
        "skill_id": "skill.debug_2026-04-19.epoch_12",
        "candidate_version": "1.12.0",
        "decision_type": "ADMITTED",
        "reason_code": "OK_ADMITTED",
        "candidate_identity_hash": "sha256:15b28333aeac332a8db3f24638a1df95bc7d374a71c55a37b3bdeb79ecbe2c57"
      },
      "entry_hash": "sha256:b837704873e271d74f85f00742e0bbbee3ee484df2485a7f9071bf55f4cecc85"
    },
    {
      "entry_index": 13,
      "ts": "2026-04-19T17:00:00+00:00",
      "prev_entry_hash": "sha256:b837704873e271d74f85f00742e0bbbee3ee484df2485a7f9071bf55f4cecc85",
      "decision": {
        "schema_name": "SKILL_PROMOTION_DECISION_V1",
        "schema_version": "1.0.0",
        "decision_id": "debug_2026-04-19_dec_013",
        "skill_id": "skill.debug_2026-04-19.epoch_13",
        "candidate_version": "1.13.0",
        "decision_type": "ADMITTED",
        "reason_code": "OK_ADMITTED",
        "candidate_identity_hash": "sha256:95c7772af726c698c8bca73522267bf91fb9503e0dbf7c578ea769a639d51218"
      },
      "entry_hash": "sha256:60caeb2f4814c3c9b47b31c568b4537a3f710a73e42bf55fdff0c032dc0831ba"
    },
    {
      "entry_index": 14,